{
	"$schema": "./schema.json",
	"packId": "buildin.amy",
	"packCredits": "",
	"folder": "amy/",
	"character": [
		{
			"id": "ddlc.fan.amy2",
			"name": "Amy",
			"styles": [
				{
					"name": "uniform",
					"label": "Uniform"
				},
				{
					"name": "casual",
					"label": "Casual attire"
				}
			],
			"heads": {
				"straight": [
					"a",
					"b",
					"c",
					"d",
					"e",
					"f",
					"g",
					"h",
					"i",
					"h",
					"k",
					"l",
					"m",
					"n",
					"o",
					"p",
					"q",
					"r",
					"s",
					"t",
					"u",
					"v",
					"w",
					"x",
					"y",
					"z"
				],
				"straight_broken_glases": ["!1", "!2", "!3", "!4", "!5"]
			},
			"poses": [
				{
					"name": "normal",
					"style": "uniform",
					"compatibleHeads": ["straight", "straight_broken_glases"],
					"left": ["1l", "2l", "3l"],
					"right": ["1r", "2r"],
					"headInForeground": true
				},
				{
					"name": "folded_hands_up",
					"style": "uniform",
					"compatibleHeads": ["straight", "straight_broken_glases"],
					"static": "5"
				},
				{
					"name": "folded_hands_down",
					"style": "uniform",
					"compatibleHeads": ["straight", "straight_broken_glases"],
					"static": "6"
				},
				{
					"name": "hands_on_glasses",
					"style": "uniform",
					"compatibleHeads": ["straight"],
					"left": ["4l"],
					"right": ["1r", "2r"]
				},
				{
					"name": "normal-casual",
					"style": "casual",
					"compatibleHeads": ["straight", "straight_broken_glases"],
					"left": ["1bl", "2bl", "3bl"],
					"right": ["1br", "2br"],
					"headInForeground": true
				},
				{
					"name": "folded_hands_up-casual",
					"style": "casual",
					"compatibleHeads": ["straight", "straight_broken_glases"],
					"static": "5b"
				},
				{
					"name": "folded_hands_down-casual",
					"style": "casual",
					"compatibleHeads": ["straight", "straight_broken_glases"],
					"static": "6b"
				},
				{
					"name": "hands_on_glasses-casual",
					"style": "casual",
					"compatibleHeads": ["straight"],
					"left": ["4bl"],
					"right": ["1br", "2br"]
				}
			]
		}
	]
}
